{
  "artifact_metadata": {
    "artifact_id": "RPT-STATUS-SET-0001",
    "artifact_type": "WORK_PACKAGE_STATUS_REPORT",
    "artifact_label": "Work Package Status Report",
    "target_scope": "SELECTED_WP_SET",
    "wp_ids": ["WP-0007", "WP-0008"],
    "source_snapshot_hash": "sha256:TEST-SELECTED-WP-SET-SNAPSHOT",
    "template_id": "TPL-RPT-WP-STATUS-REPORT-v1.0.1",
    "template_version": "v1.0.1",
    "contract_id": "VALOR-contract-orch-rpt",
    "contract_version": "v1.0.1",
    "action_type": "RPT_GENERATE_STATUS_REPORT",
    "generated_at_utc": "2026-06-12T00:00:00Z",
    "projection_only": true,
    "mutates_wp_truth": false,
    "stamps": {"bundle_ref": {"bundle_id": "BND-CQV-BASE", "bundle_version": "v1.0.1", "usage_classification": "PRODUCT_TESTING_ONLY"}},
    "validation_result": {"ok": true, "mode": "STRICT", "errors": [], "warnings": []},
    "content_ref": {"ref_type": "CONTENT_REF", "format": "REPORT_SOURCE", "uri": "artifact://RPT-STATUS-SET-0001"}
  },
  "report_type": "WORK_PACKAGE_STATUS_REPORT",
  "report_sections": [
    {"section_id": "COVER_PAGE", "title": "Cover Page", "required": true, "summary": "Selected WP set report."},
    {"section_id": "EXECUTIVE_SUMMARY", "title": "Executive Summary", "required": true, "summary": "Projection-only selected set summary."},
    {"section_id": "WORK_PACKAGE_OVERVIEW", "title": "Work Package Overview", "required": true, "summary": "Includes WP-0007 and WP-0008."},
    {"section_id": "TASK_STATUS_SUMMARY", "title": "Task Status Summary", "required": true, "summary": "Task rows must retain source wp_id."},
    {"section_id": "SCHEDULE_SUMMARY", "title": "Schedule Summary", "required": true, "summary": "Proposed and committed dates are separately labeled."},
    {"section_id": "RISKS_ISSUES_EXCEPTIONS", "title": "Risks / Issues / Exceptions", "required": true, "summary": "No test exception in this vector."},
    {"section_id": "TRACEABILITY_GOVERNANCE", "title": "Traceability and Governance", "required": true, "summary": "PRODUCT_TESTING_ONLY bundle and stamps included."},
    {"section_id": "RECOMMENDATIONS_NEXT_ACTIONS", "title": "Recommendations / Next Actions", "required": true, "summary": "Continue governed review."},
    {"section_id": "APPENDIX", "title": "Appendix", "required": true, "summary": "Per-WP source snapshot references."}
  ],
  "rendered_report_source": "# Work Package Status Report — Selected WP Set\n\nProjection Only = True\n\nTarget Scope = SELECTED_WP_SET\n\nPRODUCT TESTING ONLY — NOT APPROVED FOR REAL-LIFE REGULATED CQV/GMP USE.",
  "pdf_intent": true
}
